{
  "$schema": "http://json-schema.org/draft-07/schema#",
  "type": "object",
  "additionalProperties": false,
  "required": ["formatVersion", "id", "title", "goal", "acceptanceCriteria", "plannedPaths", "areaIds", "ruleIds", "validationCommands", "decisionPaths"],
  "properties": {
    "formatVersion": { "const": 1 },
    "id": { "type": "string", "pattern": "^[0-9]{8}-[a-z0-9-]+$" },
    "title": { "type": "string", "minLength": 1 },
    "goal": { "type": "string", "minLength": 1 },
    "acceptanceCriteria": { "type": "array", "minItems": 1, "items": { "type": "string", "minLength": 1 } },
    "plannedPaths": { "type": "array", "minItems": 1, "uniqueItems": true, "items": { "type": "string", "minLength": 1 } },
    "areaIds": { "type": "array", "minItems": 1, "uniqueItems": true, "items": { "type": "string", "minLength": 1 } },
    "ruleIds": { "type": "array", "uniqueItems": true, "items": { "type": "string", "minLength": 1 } },
    "validationCommands": { "type": "array", "minItems": 1, "uniqueItems": true, "items": { "type": "string", "minLength": 1 } },
    "decisionPaths": { "type": "array", "uniqueItems": true, "items": { "type": "string", "minLength": 1 } }
  }
}
