{"formatVersion":1,"id":"20260925-v4-ifx-c6c7-certification-runner-rebind","title":"Rebind C6 certification contract and isolate runner inputs","goal":"Remove three fail-closed certification-harness blockers without changing detector semantics, matrix cases or reviewed capabilities.","acceptanceCriteria":["C6c4 matrix contract verifies against the final C6c6 C6b0 inventory with unchanged case semantics and cardinalities.","C6c5 controls compose an exact byte-identical candidate from an external temporary root and retain 42 seven-lock plus 180 capability-broadening cases.","The Linux wrapper treats Windows-mounted Git file modes consistently with the frozen Linux candidate runner.","Fresh C6c5 parallel certification passes controls and both 191-row native matrices with semantic equality and zero gaps.","Isolated package regression and exact committed Formal Diff pass; published 1.1.3 bytes, detectors, policies, baselines, waivers, capabilities and G04 governance remain unchanged."],"plannedPaths":["docs/guards/plans/20260925-v4-ifx-c6c7-certification-runner-rebind.md","docs/guards/plans/20260925-v4-ifx-c6c7-certification-runner-rebind.plan.json","docs/guards/candidates/ifx-gate-coverage-c6c4/matrix-contract.json","docs/guards/candidates/ifx-gate-coverage-c6c4/fixture-spec.json","docs/guards/candidates/ifx-gate-coverage-c6c5/Test-IFXC6CertificationControls.ps1","docs/guards/candidates/ifx-gate-coverage-c6c5/Invoke-IFXC6LinuxCertification.ps1","docs/guards/inventories/20260925-ifx-c6c7-certification-decision.md"],"areaIds":["GuardDocs"],"ruleIds":[],"validationCommands":["ifx-package-test"],"decisionPaths":["docs/guards/V3_ifx/shared/decisions/history/20260916-v3-stage-d07-migration-unit-and-order.json","docs/guards/V3_ifx/shared/decisions/history/20260916-v3-stage-d09-trusted-base-guard-execution.json"]}
