{
  "formatVersion": 1,
  "id": "20260920-v3-stage-cp11c-profile-repository-root",
  "title": "V3 stage-oriented refactor CP11c — profile repository-root bridge",
  "goal": "Allow profile authorities to remain package-owned while generic V3 commands inspect a separate target repository.",
  "acceptanceCriteria": [
    "Generic V3 Validate, Docs, Setup and Architecture resolve profile inputs beneath an explicit ProfileRepositoryRoot, defaulting to TargetRoot for compatibility.",
    "Relative and absolute profile inputs cannot escape the declared profile repository root.",
    "The IFX facade passes its package repository for Validate, Pre, Diff and candidate generation.",
    "Generic tool tests and IFX target-root separation pass without changing gate verdicts or moving policy authorities."
  ],
  "plannedPaths": [
    "docs/guards/V3/commands/Invoke-V3.ps1",
    "docs/guards/V3/commands/Invoke-V3Docs.ps1",
    "docs/guards/V3/commands/Invoke-V3Setup.ps1",
    "docs/guards/V3/scripts/Invoke-V3Architecture.ps1",
    "docs/guards/V3/scripts/ProfileLayout.psm1",
    "docs/guards/V3/tests/Test-V3Tools.ps1",
    "docs/guards/V3_ifx/commands/Invoke-IFXGuardrails.ps1",
    "docs/guards/plans/20260920-v3-stage-cp11c-profile-repository-root.md",
    "docs/guards/plans/20260920-v3-stage-cp11c-profile-repository-root.plan.json"
  ],
  "areaIds": [
    "GuardDocs",
    "GuardPackage"
  ],
  "ruleIds": [],
  "validationCommands": [
    "ifx-package-test"
  ],
  "decisionPaths": [
    "docs/guards/V3_ifx/decisions/history/20260916-v3-stage-d01-v3-ifx-distribution-boundary.json",
    "docs/guards/V3_ifx/decisions/history/20260916-v3-stage-d07-migration-unit-and-order.json",
    "docs/guards/V3_ifx/decisions/history/20260916-v3-stage-d15-trusted-base-component-upgrade.json",
    "docs/guards/V3_ifx/decisions/history/20260917-v3-stage-d23-protected-change-obligations.json"
  ]
}
