{
  "formatVersion": 1,
  "id": "20260920-v3-stage-cp11c-profile-repository-root-authorization",
  "title": "Authorize CP11c profile repository-root bridge",
  "goal": "Pre-authorize the exact trusted-base changes that separate package-owned profile inputs from the inspected target repository.",
  "acceptanceCriteria": [
    "The authorization binds the exact prepared candidate tuples for every affected trusted component.",
    "The authorization-only change modifies no trusted component or production policy.",
    "The candidate consumes the authorization in the same protected diff."
  ],
  "plannedPaths": [
    "docs/guards/V3_ifx/stages/diff/authorizations/cp11c-profile-repository-root-trusted-base.json",
    "docs/guards/plans/20260920-v3-stage-cp11c-profile-repository-root-authorization.md",
    "docs/guards/plans/20260920-v3-stage-cp11c-profile-repository-root-authorization.plan.json"
  ],
  "areaIds": [
    "GuardDocs",
    "GuardPackage"
  ],
  "ruleIds": [],
  "validationCommands": [
    "ifx-package-test"
  ],
  "decisionPaths": [
    "docs/guards/V3_ifx/decisions/history/20260916-v3-stage-d07-migration-unit-and-order.json",
    "docs/guards/V3_ifx/decisions/history/20260916-v3-stage-d15-trusted-base-component-upgrade.json",
    "docs/guards/V3_ifx/decisions/history/20260917-v3-stage-d23-protected-change-obligations.json"
  ]
}
