{
  "formatVersion": 1,
  "id": "20260921-v3-stage-p11-final-tcb-r7-authorization",
  "title": "P11.4 final TCB authorization r7",
  "goal": "Pre-authorize the complete P11.4 TCB obligation after making trusted-base executable discovery ignore only the exact closed pre-layout compatibility comment.",
  "acceptanceCriteria": [
    "The immutable change-trusted-base record binds candidate b87beb1c, all 19 changed components, all 753 changed trusted paths, and the base-owned validation suites.",
    "The manifest checker and trusted-base verifier exclude only the exact syntactically closed non-executable PRE-LAYOUT CI CONTRACT block; malformed blocks and executable references outside it remain visible and fail closed.",
    "This authorization-only pull request changes only this formal plan pair and the r7 authorization record, qualifies for records-and-plans CI scope, and passes all 13 required checks."
  ],
  "plannedPaths": [
    "docs/guards/V3_ifx/stages/diff/authorizations/p11-final-trusted-base-r7.json",
    "docs/guards/plans/20260921-v3-stage-p11-final-tcb-r7-authorization.md",
    "docs/guards/plans/20260921-v3-stage-p11-final-tcb-r7-authorization.plan.json"
  ],
  "areaIds": [
    "GuardDocs",
    "GuardPackage"
  ],
  "ruleIds": [],
  "validationCommands": [
    "ifx-package-test"
  ],
  "decisionPaths": [
    "docs/guards/V3_ifx/decisions/history/20260916-v3-stage-d10-protected-change-authorization.json",
    "docs/guards/V3_ifx/decisions/history/20260917-v3-stage-d19-trusted-base-first-introduction.json",
    "docs/guards/V3_ifx/decisions/history/20260921-v3-stage-d35-windows-portability-smoke.json",
    "docs/guards/V3_ifx/decisions/history/20260921-v3-stage-d36-p11-minimal-compat-bridge.json",
    "docs/guards/V3_ifx/decisions/history/20260921-v3-stage-d37-p11-candidate-layout-compatibility.json",
    "docs/guards/V3_ifx/decisions/history/20260921-v3-stage-d38-cross-platform-inventory-bytes.json"
  ]
}
