{"formatVersion":1,"id":"20260924-v4-ifx-c1-r3a-pre-timeout-budget","title":"Bound full-tree C1 Pre module execution at 180 seconds","goal":"Remove the measured 30-second candidate-module timeout without changing detection semantics or the published 1.1.3 base.","acceptanceCriteria":["Only nine C1 Pre module manifest timeoutSeconds values change from 30 to 180; adapter/policy/rule-plan hashes stay fixed.","Module schemas and capability ceilings remain valid, with network false and no write roots.","Integrated real IFX Pre proceeds to a rule verdict; isolated package regression, Formal Pre and exact Formal Diff pass."],"plannedPaths":["docs/guards/plans/20260924-v4-ifx-c1-r3a-pre-timeout-budget.md","docs/guards/plans/20260924-v4-ifx-c1-r3a-pre-timeout-budget.plan.json","docs/guards/candidates/ifx-gate-coverage-c1b/modules/ifx-domain-reference/module.json","docs/guards/candidates/ifx-gate-coverage-c1c/modules/ifx-package-reference/module.json","docs/guards/candidates/ifx-gate-coverage-c1d/modules/ifx-ring-graph/module.json","docs/guards/candidates/ifx-gate-coverage-c1e/modules/ifx-ownership-graph/module.json","docs/guards/candidates/ifx-gate-coverage-c1f/modules/ifx-provider-cycle/module.json","docs/guards/candidates/ifx-gate-coverage-c1g/modules/ifx-embedded-adapter/module.json","docs/guards/candidates/ifx-gate-coverage-c1j/modules/ifx-project-name/module.json","docs/guards/candidates/ifx-gate-coverage-c1n/modules/ifx-reference-cycle/module.json","docs/guards/candidates/ifx-gate-coverage-c1o/modules/ifx-injection/module.json"],"areaIds":["GuardDocs"],"ruleIds":[],"validationCommands":["ifx-package-test"],"decisionPaths":["docs/guards/V3_ifx/shared/decisions/history/20260916-v3-stage-d07-migration-unit-and-order.json","docs/guards/V3_ifx/shared/decisions/history/20260916-v3-stage-d09-trusted-base-guard-execution.json"]}
