{
  "formatVersion": 1,
  "id": "20260920-v3-stage-cp11d-history-relocation-bridge-authorization",
  "title": "Authorize CP11d Historical Integrity relocation bridge",
  "goal": "Pre-authorize the exact trusted-base and policy-registry bridge required before relocating Historical Integrity into the Post stage.",
  "acceptanceCriteria": [
    "The trusted-base authorization binds the exact transition selectors, tests and registry tuple.",
    "The weaken-policy authorization covers only the temporary policy-config destination registration.",
    "The authorization-only change modifies no trusted component or production policy.",
    "The bridge candidate consumes both authorizations in the same protected diff."
  ],
  "plannedPaths": [
    "docs/guards/V3_ifx/stages/diff/authorizations/cp11d-history-relocation-bridge-tcb.json",
    "docs/guards/V3_ifx/stages/diff/authorizations/cp11d-history-relocation-bridge-weaken-policy.json",
    "docs/guards/plans/20260920-v3-stage-cp11d-history-relocation-bridge-authorization.md",
    "docs/guards/plans/20260920-v3-stage-cp11d-history-relocation-bridge-authorization.plan.json"
  ],
  "areaIds": [
    "GuardDocs",
    "GuardPackage"
  ],
  "ruleIds": [],
  "validationCommands": [
    "ifx-package-test"
  ],
  "decisionPaths": [
    "docs/guards/V3_ifx/decisions/history/20260916-v3-stage-d07-migration-unit-and-order.json",
    "docs/guards/V3_ifx/decisions/history/20260916-v3-stage-d08-historical-integrity-stage.json",
    "docs/guards/V3_ifx/decisions/history/20260916-v3-stage-d13-policy-config-monotonicity.json",
    "docs/guards/V3_ifx/decisions/history/20260916-v3-stage-d15-trusted-base-component-upgrade.json",
    "docs/guards/V3_ifx/decisions/history/20260917-v3-stage-d23-protected-change-obligations.json",
    "docs/guards/V3_ifx/decisions/history/20260917-v3-stage-d24-policy-config-dual-track.json"
  ]
}
