{
  "formatVersion": 1,
  "id": "20260916-v3-stage-cp02-p1-decisions-drift",
  "title": "V3 stage-oriented refactor CP02 \u2014 P1 decision verification, drift repair, CI contract and minimal manifests",
  "goal": "Verify and supplement the refactor decisions, repair the registered pre-migration drift with CI recurrence checks, add a read-only workflow/jobs/ruleset contract verifier, and freeze the minimal guard-system, stage, command and trusted component manifests needed by P2 without moving or deleting protected paths.",
  "acceptanceCriteria": [
    "D1-D15 records pass ID, schema and affectedPaths verification, and D16-D17 record the decisions derived from the P0 baseline.",
    "Profile views, architecture drafts, analysis outputs, the migration record, the SourceConfig area, the historical-integrity trigger and the ArchUnit fixture no longer drift, and the documented DEPLOYMENT procedure passes.",
    "Invoke-IFXGuardrails Validate runs profile-views, ci-contract and manifest-check, and Test-IFXCiContract, Test-IFXManifests and Test-V3ArchUnit run in v3-architecture.",
    "Invoke-IFXCiContract passes locally and against the live ruleset with strict mode and all 13 required contexts; required check names are unchanged.",
    "guard-system.json, commands.json, stage.json and trusted-components.json validate against their schemas with single field owners, one gate per required check and a self-protecting trusted component manifest covering every verdict-chain script."
  ],
  "plannedPaths": [
    ".github/workflows/v3-ifx-guardrails.yml",
    "docs/guards/V3/contracts/commands.schema.json",
    "docs/guards/V3/contracts/guard-system.schema.json",
    "docs/guards/V3/contracts/stage.schema.json",
    "docs/guards/V3/contracts/trusted-components.schema.json",
    "docs/guards/V3/tests/Test-V3ArchUnit.ps1",
    "docs/guards/V3_ifx/DEPLOYMENT.md",
    "docs/guards/V3_ifx/analysis/ifx/ARCHITECTURE-REVIEW.md",
    "docs/guards/V3_ifx/analysis/ifx/ARCHITECTURE.md",
    "docs/guards/V3_ifx/analysis/ifx/INVENTORY.md",
    "docs/guards/V3_ifx/analysis/ifx/TECHNICAL.md",
    "docs/guards/V3_ifx/analysis/ifx/architecture-review.json",
    "docs/guards/V3_ifx/analysis/ifx/inventory.json",
    "docs/guards/V3_ifx/analysis/ifx/refactor-progress/cp02-ci-contract-remote.json",
    "docs/guards/V3_ifx/analysis/ifx/review-profile/project-map.json",
    "docs/guards/V3_ifx/analysis/ifx/review-profile/tech-stack.json",
    "docs/guards/V3_ifx/architecture/IFX-MIGRATION.md",
    "docs/guards/V3_ifx/ci/Invoke-IFXCiContract.ps1",
    "docs/guards/V3_ifx/ci/jobs.json",
    "docs/guards/V3_ifx/contracts/commands.schema.json",
    "docs/guards/V3_ifx/contracts/guard-system.schema.json",
    "docs/guards/V3_ifx/contracts/stage.schema.json",
    "docs/guards/V3_ifx/contracts/trusted-components.schema.json",
    "docs/guards/V3_ifx/decisions/history/20260916-v3-stage-d16-comparator-order-by-commit-frequency.json",
    "docs/guards/V3_ifx/decisions/history/20260916-v3-stage-d17-plan04-phase-validator-retirement.json",
    "docs/guards/V3_ifx/generated/stages/project-map.json",
    "docs/guards/V3_ifx/guard-system.json",
    "docs/guards/V3_ifx/profiles/ifx/project-map.json",
    "docs/guards/V3_ifx/profiles/ifx/views/PROJECT_MAP.md",
    "docs/guards/V3_ifx/profiles/ifx/views/TECH_STACK.md",
    "docs/guards/V3_ifx/scripts/Invoke-IFXGuardrails.ps1",
    "docs/guards/V3_ifx/scripts/Invoke-IFXManifestCheck.ps1",
    "docs/guards/V3_ifx/shared/commands.json",
    "docs/guards/V3_ifx/shared/trusted-components.json",
    "docs/guards/V3_ifx/stages/analysis/stage.json",
    "docs/guards/V3_ifx/stages/bootstrap/stage.json",
    "docs/guards/V3_ifx/stages/ci/stage.json",
    "docs/guards/V3_ifx/stages/diff/stage.json",
    "docs/guards/V3_ifx/stages/post/stage.json",
    "docs/guards/V3_ifx/stages/pre/stage.json",
    "docs/guards/V3_ifx/tests/Test-IFXCiContract.ps1",
    "docs/guards/V3_ifx/tests/Test-IFXManifests.ps1",
    "docs/guards/V3_ifx/tests/Test-V3ArchUnit.ps1",
    "docs/guards/plans/06-v3-stage-oriented-package-refactor.md",
    "docs/guards/plans/20260916-v3-stage-cp02-p1-decisions-drift.md",
    "docs/guards/plans/20260916-v3-stage-cp02-p1-decisions-drift.plan.json",
    "docs/guards/plans/20260916-v3-stage-oriented-package-refactor.md"
  ],
  "areaIds": [
    "CI",
    "GuardDocs",
    "GuardPackage"
  ],
  "ruleIds": [],
  "validationCommands": [
    "ifx-package-test"
  ],
  "decisionPaths": [
    "docs/guards/V3_ifx/decisions/history/20260916-v3-stage-d04-read-only-generated-markdown.json",
    "docs/guards/V3_ifx/decisions/history/20260916-v3-stage-d07-migration-unit-and-order.json",
    "docs/guards/V3_ifx/decisions/history/20260916-v3-stage-d08-historical-integrity-stage.json",
    "docs/guards/V3_ifx/decisions/history/20260916-v3-stage-d09-trusted-base-guard-execution.json",
    "docs/guards/V3_ifx/decisions/history/20260916-v3-stage-d11-lightweight-workflow-template.json",
    "docs/guards/V3_ifx/decisions/history/20260916-v3-stage-d13-policy-config-monotonicity.json",
    "docs/guards/V3_ifx/decisions/history/20260916-v3-stage-d14-package-local-build-baseline.json",
    "docs/guards/V3_ifx/decisions/history/20260916-v3-stage-d15-trusted-base-component-upgrade.json",
    "docs/guards/V3_ifx/decisions/history/20260916-v3-stage-d16-comparator-order-by-commit-frequency.json",
    "docs/guards/V3_ifx/decisions/history/20260916-v3-stage-d17-plan04-phase-validator-retirement.json"
  ]
}
